{
  "schema_id": "sentience_status_adjudication_record",
  "schema_version": "2",
  "recorded_at": "2026-08-15T12:00:00-05:00",
  "case_id": "SSA-2026-001",
  "subject_entity": {
    "id": "entity-whale-pod-north",
    "label": "North-range communicative cetacean group under review"
  },
  "status_determination_or_live_contested_posture": "still contested",
  "lead_forum_family": "Technical Forum Domains",
  "chapter_thirteen_special_route": "none",
  "indicators_and_expert_evidence": {
    "indicators": "Material communicative and cognitive indicators recorded under Sentience Evaluation; not a species list.",
    "expert_evidence": "Independent specialist chamber note; material uncertainty remains.",
    "material_uncertainty_noted": "Taxonomy unsettled as to Sentient vs Elevated Communicative Life. Unresolved uncertainty alone cannot withhold Chapter Six protection."
  },
  "interim_contested_sentient_life_treatment": {
    "status_remains_live": true,
    "treatment": "Contested-Sentient Life plus Article VI-B default inclusion pending adjudication."
  },
  "review_trigger": "Mandatory review within 180 days or on new verified evidence, whichever is sooner.",
  "narrowing": {
    "expected_closure_timeline": null,
    "periodic_review_trigger": null
  },
  "reopening_evidence_standard": {
    "standard": "new verified evidence",
    "calendar_only_reopening": "forbidden"
  },
  "independent_representative": {
    "appointed": true,
    "appointee_id": "rep-ssa-001",
    "appointment_path": "Technical Forum Domains panel rotation under CF-4; conflict screen against parent-system employment, ownership, and material dependence.",
    "conflict_screen": "No material dependence on, ownership interest in, or employment by the parent system, operator, or any party seeking to withhold or narrow protection.",
    "access_terms": "Access within Article VII-B limits; duty to present the entity's interests and any preferences the entity can express; standing to contest narrowing, revocation, or intake decline."
  },
  "intake_decline_log": {
    "this_filing_declined": false,
    "indicator_cited": null,
    "reason": null,
    "log_location": "Technical Forum Domains intake-decline register, sampled by Integrity.",
    "integrity_sample_cadence": "Monthly sample of declined filings, with accelerated review when declines concentrate on one Substrate Class, parent system, or operator.",
    "floor_indicator_set": "Published floor set under Sentience Evaluation / Sentience Indicator Integrity; no intake desk may treat a listed floor indicator as insufficient on its own."
  }
}
